{
  "protocolVersion": 1,
  "agent": {
    "id": "agt_example",
    "version": "0.0.0.0",
    "hostname": "006a45258a4d"
  },
  "report": {
    "outcome": "passed",
    "startedAt": "2026-08-11T10:18:56Z",
    "postgresMajor": 17,
    "artefact": {
      "fileName": "db.dump",
      "sizeBytes": 519734,
      "lastModified": "2026-08-11T10:18:56Z",
      "dumpedFromMajor": 17
    },
    "measuredRpoSeconds": 0,
    "measuredRtoMilliseconds": 185,
    "checks": [
      {
        "level": 1,
        "key": "artefact_present",
        "outcome": "passed",
        "detail": "db.dump, 507.6 KiB, written 0.0 h ago"
      },
      {
        "level": 1,
        "key": "artefact_within_rpo_window",
        "outcome": "passed",
        "detail": "0.0 h old, window is 24.0 h"
      },
      {
        "level": 1,
        "key": "restore_exit_code",
        "outcome": "passed",
        "detail": "pg_restore exited 0"
      },
      {
        "level": 1,
        "key": "expected_tables_present",
        "outcome": "passed",
        "detail": "all 1 table(s) named in the artefact are in the restored database"
      },
      {
        "level": 1,
        "key": "restored_database_not_empty",
        "outcome": "passed",
        "detail": "20000 row(s) across 1 table(s)"
      },
      {
        "level": 3,
        "key": "rls_enabled_and_forced_preserved",
        "outcome": "passed",
        "detail": "all 2 row level security statement(s) the artefact declares are present in the restored database, identical"
      },
      {
        "level": 3,
        "key": "policies_identical",
        "outcome": "passed",
        "detail": "all 1 policy(s) the artefact declares are present in the restored database, identical"
      },
      {
        "level": 3,
        "key": "grants_identical",
        "outcome": "passed",
        "detail": "all 1 grant(s) the artefact declares are present in the restored database, identical"
      },
      {
        "level": 3,
        "key": "row_level_security_actually_restricts",
        "outcome": "passed",
        "detail": "with no tenant context set, the owner sees fewer rows than the whole table on all 1 forced table(s): public.tenant_rows: 0 of 20000 rows visible to source"
      }
    ],
    "rowCounts": {
      "public.tenant_rows": 20000
    },
    "observations": [
      "the artefact declares 1 table(s), 1 policy(ies), 2 row level security statement(s) and 1 grant(s)",
      "the artefact references role(s): app_role, source",
      "the artefact does not carry the cluster globals, so 2 role(s) were created empty to let the restore complete: app_role, source"
    ],
    "notAttempted": [
      "row_counts_within_tolerance: a tolerance needs a previous drill to compare against. The 1 count(s) in this report are what the next one will be measured against.",
      "level 3, role attributes: roles are cluster-wide and a per-database pg_dump does not contain them, so whether any role holds BYPASSRLS cannot be tested. Add the pg_dumpall --globals-only artefact to this target and it becomes testable. This is a correction, not a verdict.",
      "level 3, application role isolation: the placeholder roles have no memberships or attributes, so what the real application role could read cannot be established from this artefact alone.",
      "level 3, customer SQL assertions: not implemented yet",
      "level 2 entirely: extensions, sequences, constraints, foreign keys, functions and triggers"
    ]
  },
  "agentSignature": {
    "algorithm": "HMAC-SHA256",
    "keyId": "agt_example",
    "value": "NAwPZ2moJ-xfsYveDqTMkRJtm03Xo79VRnnCcpf6GQ4"
  }
}
